名前,説明,分布,分布番号,時期,英語名
カブトムシ,子どもたちに人気がある、なじみ深い大型のコガネムシの仲間。オスは、光沢のある黒褐色～赤褐色で、頭部に先端が4つに分かれた長い立派な角をもつ。前胸部にも先が2つに分かれた小さな角がある。個体によって角の形状には変異があり、小型の個体は頭部の角が小さく先端が2つにしか分かれない場合がある。メスは角をもたず、茶褐色で、全体が微毛でおおわれ光沢は鈍い。,北海道・本州・四国・九州,1234,3月-9月,rhinoceros_beetle
ナナホシテントウ,黄赤地に７つの黒紋をもつ、最もなじみ深いテントウムシ。草原や畑などでよく見られる。成虫で越冬し、春早くから活動を始める。かわいらしげなイメージとは違って、肉食性の昆虫で、成虫・幼虫ともに植物に付くアブラムシを食べる。,全国どこでも,12345,3-11月,ladybird
アブラゼミ,茶色のまだら模様の翅を持ったおなじみのセミ。真夏、いたるところに現れ、ジージーと油が煮えたぎるようにうるさく鳴く。電信柱や人家の壁にとまって鳴くことも多い。,北海道・本州・四国・九州,1234,7-9月,cicada
クロゴキブリ,だれもが知っている屋内害虫。全身が光沢のある黒褐色で、まるで油を塗ったよう。中国南部が原産地と考えられる帰化昆虫で、人家内やその付近に棲んでいる。過去には関東以南にのみ生息していたが、近年は北海道の人家にも定着している。,北海道・本州・四国・九州,1234,1年中,cockroach
モンシロチョウ,野原や畑でふつうに見られ、フワフワと飛ぶ白いチョウ。いろいろな花で吸蜜する。特に幼虫の食草であるキャベツ畑やアブラナ畑に多く、葉っぱを注意深く捜せば、卵や幼虫も簡単に見つけることができる。なじみ深いチョウだが、近似種のスジグロシロチョウや、モンキチョウの白色型のメスと見間違うことがある。,全国どこでも,12345,3-11月,cabbage_butterfly
モンキチョウ,原っぱ、公園、河原など開けた環境に広く生息する黄色いチョウ。メスには、白っぽいタイプもいる。大きさはモンシロチョウとほぼ同じ。活発に飛び、いろいろな花で吸蜜する。早春からあらわれ、晩秋まで見られる。幼虫はアカツメクサ、シロツメクサなどを食べる。,全国どこでも,12345,3-11月,colias_butterfly
ヒメスズメバチ,オオスズメバチに次ぐ大きさの種類でヒメスズメバチは腹部が黒色。あまり攻撃してこない。アシナガバチ類の幼虫や蛹を狩る。,北海道・本州・四国・九州,1234,4-10月,hornet
オオスズメバチ,頭が黄橙色、胸が黒色、腹部は黄橙色と黒色の縞模様の、親指大の大きなハチ。日本のハチの中で最大の種で、スズメバチの仲間としては世界最大。ヒメスズメバチに似るが、腹端（尾節）の色で見分けられる（オオスズメバチの腹端は黄色で、ヒメスズメバチの腹端は黒色）。コガタスズメバチにも似るが、本種のほうがより大きいことや、働き蜂の場合は頭楯（頭部正面の大顎や両複眼に囲まれた部分）の下の突起が2個であることで見分けられる（コガタスズメバチは3個）,北海道・本州・四国・九州,1234,4-10月,hornet
ニホンミツバチ,最もなじみ深いハチのひとつ。暗茶褐色で、腹部に縞模様がある。セイヨウミツバチより全体に黒っぽく、腹部上部はオレンジ色にならない（セイヨウミツバチはオレンジ色）。木の洞や地中に巣を作る。セイヨウミツバチは養蜂のために移入されたものだが、この種類はもともと日本にいたもの。アジア全域に分布し、その全体を指してトウヨウミツバチと呼ぶ。ニホンミツバチは、トウヨウミツバチの亜種（Apis cerana japonica）にあたる。,北海道・本州・四国・九州,1234,,honey_bee
オオマルハナバチ,黒色と黄白色の毛で全身がおおわれたハチ。顔にも黒い毛がはえている。いろいろな花を盛んに訪れる。,北海道・本州・四国・九州,1234,4-10月,bumblebee
ザリガニ,赤褐色で大きなハサミを持ったおなじみの生き物。田、水路、溝、池沼、河川（中流～下流）などで普通に見られる。水質の悪化や、水温上昇、水位変動などに強く、さまざまな環境に適応できる。年頃に、養殖用ウシガエルのエサとして北アメリカから移入された帰化動物。,本州・四国・九州,234,3-11月,crayfish
ダンゴムシ,黒褐色で、身を守るために体を完全に丸くすることができる生き物。人家の庭や公園、荒地など、いろいろな場所で見られる。石の下や落ち葉の下に多い。ヨーロッパ原産の帰化動物。,全国どこでも,12345,1年中,isopod
ウスバキトンボ,アカトンボに似ているが、やや大きくて、翅の幅が広めの、くすんだ黄色～赤褐色のトンボ。全世界の熱帯・亜熱帯で見られる。日本には初夏の頃に、南の国からやって来て、どんどん北に向かって分布を広げるが、冬は越せずに死んでしまう。秋に個体数が多くなる。学校のプールでもよく発生する。,全国どこでも,12345,4-11月,dragonfly
ショウリョウバッタ,頭部が尖った大きなバッタ。特にメスは大きく、８cmにもなる。オスは細身で４～５cm程度と小さい。緑色型と褐色型がある。明るい原っぱでよく見られ、住宅地周辺にも生息する。地上性で、驚くと翅を使って遠くまで飛ぶ。オスは、飛ぶときにチキチキという音をたてる。,本州・四国・九州・沖縄,2345,8-11月,grasshopper
カマキリ,緑色または茶色の大きなカマキリ。林縁の草むらや樹上で多く見られ、開けた原っぱにはあまりいない。あらゆる昆虫を強力な鎌足で捕らえて食べる。時には、カエルやトカゲを食べることもある。チョウセンカマキリに似ているが、本種の方が、体が大きくて太いことと、後翅が紫褐色をしていることで見分けられる。,北海道・本州・四国・九州,1234,8-11月,mantis
アマガエル,黄緑色～灰褐色で、鼻先から鼓膜にかけて黒帯があるずんぐりしたカエル。体表は滑らか。周囲の環境によって、体色を変えることができる。平地、山地に広く分布し、草原や林縁、水田のほか、市街地の公園や人家の庭先などでも見られる。,北海道・本州・四国・九州,1234,3-11月,ranidae
ニホンイモリ,黒褐色で、腹面は全体に赤く、不規則な黒褐色斑がある。腹面の色彩や斑紋は、地域や個体による変異が大きい。池、水田、湿地などの水中で見られる。世界中のイモリ科の中で、最も北に分布する。,本州・四国・九州,234,4-10月,salamandridae
ヤモリ,灰褐色で、全身が細かい顆粒状の鱗で覆われ、乾いた感じがするトカゲ。体は平たい。人家の内外でよく見られ、壁や天井を歩き回る。夜行性で、灯火の周辺などに現れ、光に集まってきた昆虫を食べる。,本州・四国・九州,234,4-11月,gecko
ヘビ,暗青色～茶褐色の大きなヘビ。森林から人家周辺まで広く生息する。樹上でよく見られる。ネズミ、鳥、鳥の卵などを食べる。,北海道・本州・四国・九州,1234,4-11月,snake
イオウイロハシリグモ,脚の長い大きなクモ。個体によって色彩変異が大きく、黄色や褐色の単色のもの、褐色で体側に白い帯があるもの、黒褐色のまだら模様があるもの（下の写真）など、さまざま。雑木林周辺の草や低木の葉上でよく見られる,全国どこでも,12345,7-10月,arachnid
ナガコガネグモ,腹部に黄色と黒のこまかい縞模様がある大きなクモ。草原や林の周辺、水田などに、円網を張る。網には、ジグザグの直線状や円盤状など、さまざまな形のかくれ帯をつけ、その中央にとまる。,全国どこでも,12345,8-11月,yellow_garden_spider
アカミミガメ,甲羅は緑褐色、頭部や四肢は暗緑色で、側頭部に鮮やかな赤い斑紋があるカメ。アメリカ大陸原産の帰化種。河川、池沼などに広く生息し、都市部の池、公園などでも見られる。雑食性で、魚、ザリガニ、貝類、水草などを食べる。幼体は黄色味の強い緑色で、ミドリガメと呼ばれる。,全国どこでも,12345,4-11月,emydidae
トビズムカデ,胴体は暗藍色で頭部は赤褐色、脚は黄色の日本最大のムカデ。雑木林の林床周辺で見られるが、人家内に侵入することも多い。不用意につかむと大あごで噛みつかれるので要注意。,本州・四国・九州・沖縄,2345,3-11月,centipede
ヤマタニシ,殻は茶褐色～黒褐色で、蓋を持つ。長い後触角を伸ばして移動する。山地の落ち葉や礫の下で見られる。,本州（中部以南）・四国・九州,234,1年中,snail
オオカバマダラ,きれいな黒とオレンジのはねを持つマダラチョウの仲間。アメリカのオオカバマダラはロッキー山脈を境に、それぞれ西部個体群と東部個体群に分けられ、秋になると西部個体群はカリフォルニア、東部個体群はメキシコに移動する。渡り鳥のような蝶として有名。,南西諸島・小笠原諸島,5,9月-11月,monarch_butterfly
カモメ,冬の河口などにたくさん群れていて、主に魚類、動物の死骸など何でも食べてしまう。繁殖様式は卵生。集団繁殖地（コロニー）を形成する。沿岸部の岩礁や草原などに巣を作り、卵を産む。生後3年で成鳥羽に生え換わる。,全国どこでも,12345,秋から冬,gull
サワガニ,甲羅は褐色、脚は赤褐色のカニ。山間部の沢や渓流で普通に見られる。夜行性で、日中は石の下などにひそんでいる。メスは大きな卵を産み、孵化後の幼生を保護する。,北海道・本州・四国・九州,1234,3-11月,freshwater_crab
ハト,ドバトは全国の駅、公園などの市街地などに生息し、田畑でも見られます。基本的に人の営みのある場所にしかいません。巣は人工建造物の屋根裏、橋脚などの安全な場所に作ります。羽色は白色、黒色、茶色など様々な種類が見られ、特にカワラバトによく似た首の部分が金属調の緑色や紫色をしたものが多いです。,全国どこでも,12345,1年中,pigeons_and_doves
アライグマ,タヌキに似ており、アライグマを英語でraccoon (common raccoon) と呼ぶのに対し、タヌキは raccoon dog と呼ぶ。前足を水中に突っ込んで獲物を探る姿が手を洗っているように見えることが名称の由来である。北アメリカ原産で、日本やヨーロッパにも外来種として生息する。移入後の繁殖により、農作物への被害や生態系への影響などが問題となっている。,全国どこでも,12345,1年中,raccoon
ニホンジカ,オスは枝分かれしたツノを持つ。牛・豚・馬などの皮革に比べて鹿皮は薄く柔らかいため、なめして細かい加工を要する手袋などに適し、時に柔らかい靴やソファーなどの材料となる。また、枝角はナイフの柄やボタンなどに用いられている。,北海道・本州・四国・九州,1234,1年中,deer
スズメ,日本中に分布していて、市街地、住宅地などにいる他、人家のある集落には生息しています。留鳥で渡りはしないと考えられていますが、新潟県から岡山県、愛知県、関東地方などへ移動するものはいます。,全国どこでも,12345,1年中,sparrow
ネズミ,家の屋根裏によくいる。家に住むのは９割がクマネズミ。野生のネズミ種は世界中のありとあらゆる自然に適応しており、砂漠にはスナネズミ、川にはカワネズミ、アマゾンにはカピバラがそれぞれ生息している。,全国どこでも,12345,1年中,mouse
フクロウアカアシモリ,チリやアルゼンチンがある南アメリカ大陸の林にくらしています。主に夫婦で生活します。昼間は木の穴などに作った巣の中で休んでいて、夜になるとエサのネズミやカエルなどを探しに出かけます。繁殖期には２〜５個の卵を産み、ひなが生まれると、お父さんがエサを運び、お母さんがひなの世話をして協力して子育てをこないます。ヒナは約１〜２ヶ月で少しずつ飛べるようになり、その後、２〜3ヶ月間お父さんとお母さんから飛んだりエサをとる方法を学び独り立ちします。,兵庫,hyougo,1年中,great_grey_owl
ニホンザル,日本の鹿児島県から青森県にかけての森の中で暮らしています。中でも青森県に住むニホンザルは人間をのぞき一番北に住んでいるサルの仲間として知られます。暮らしている環境やエサの量によって異なりますが，20~100頭前後の群をつくります。昼間に行動し，夜は森の中で休んでいます。秋に恋の季節をむかえ，春に出産します。メスの子どもはずっと群れにとどまりますが，オスの子どもは大きくなると群を出て，様々な群を渡り歩いたり単独で行動したりします。,本州・四国・九州,234,1年中,japanese_macaque
ヒツジ,約8000年前から家畜として飼育されていることが知られます。群で生活し、先頭に立つものに常に従って動きます。乾燥した草原などウシやブタが生きていけない気候でも生活する事が出来て，乳や肉も食べられるため、多くの地域で飼育されています。品種改良されているため、家畜として飼われるヒツジの毛は一生伸び続け、一年に一度刈り取られて、衣服などの材料になります。,北海道・本州・四国・九州,1234,1年中,sheep
モルモット,南アメリカに住んでいたテンジクネズミを，少なくとも3000年前からが家畜化したのがモルモットです。朝方や夕方に活動しますが、とてもおとなしく、高い所に登ったり、ジャンプしたりすることはありません。年中子どもを作ることが出来、約２ヶ月の妊娠期間をへて２～4頭の赤ちゃんを産みます。,北海道・本州・四国・九州,1234,1年中,guinea_pig
ウサギ,世界中の草原などに住んでいて，色々な種類に分かれています。ウサギの大きな耳は、音がする方向に動かすことが出来て，敵をみつけるのに役立っています。前足よりも後ろ足が長く，いざ敵を見つけると，時速60kmで跳ねて逃げ出します。一度に1~6頭の子どもを生みます。,北海道・本州・四国・九州,1234,1年中,rabbit
ニワトリ,世界中で卵や肉を食用に、羽毛を防寒具に利用するために飼育されています。ほとんどが家禽として飼育されますが、オナガドリなど観賞用として飼育されるものもいます。朝にコケコッコーと鳴くのはオスだけで、メスは卵を産んだり敵を見つけた時にしか鳴くことがありません。羽は小さく、飛ぶことは出来ませんが、屋根の上ぐらいまでは飛び上がることが出来ます。ニワトリには用途に応じて非常にたくさんの種類が存在しています。,北海道・本州・四国・九州,1234,1年中,chicken
キタキツネ,北海道の平地から高山帯まで、広く生息している。ネズミやエゾユキウサギ、鳥類、昆虫などを主に食べる。秋には果実や木の実も食べる。観光地では、昼間に路上を歩いて観光客に餌をねだったり、ごみ捨て場の残飯や牧場で出産時に捨てられた牛の胎盤を餌とする個体もいる。土手などに穴を掘り、巣穴とする。春先に子供を産み、秋にかけて雌が育てる。雄は単独で行動し、子育てはしない。,北海道,1,秋から冬,red_fox
ペンギン,南大西洋やインド洋の南極の周辺にある島々や海でくらしています。子育てをするとき以外は，外洋で群を作り生活します。とても遠くまで行動することでも知られ，ニュージーランドの近くまで出かけることがわかっています。夏のはじめに卵を産み，足の上に卵をのせて，約２ヶ月温め子育ても共同で行います。,北海道・本州・四国・九州・沖縄,12345,1年中,penguin
ミミズ,主に落ち葉や微生物を餌にする。一年中いつでも土を掘り返せば見られる。石や鉢植えをひっくり返しても見付かる。,全国どこでも,12345,1年中,earthworm
コールダック,マガモを品種改良したアヒルを，さらに品種改良して出来た鳥です。アヒルと比べると４分の１の大きさで，世界最小のアヒルといわれています。品種改良がされた当初は，野生のカモをつかまえるためのおとりとして使われていましたが，今では観賞用やペットとして飼育されています。卵を産んでから１ヶ月温めるとヒナがふ化します。,北海道・本州・四国・九州・沖縄,12345,1年中,duck
コイ,"体長30～100cm。口ひげは2対あり,口ひげをもたないフナ属との区別は容易。背鰭と臀鰭の前方の軟条は硬く,がんじょうで,棘のようになっている。成熟すると雌雄ともに体の全面に顆粒状の追星があらわれるが,その程度はメスよりオスのほうが著しい。",北海道・本州・四国・九州・沖縄,12345,1年中,common_rudd
ヒグマ,ホッキョクグマと並びクマ科では最大の体長を誇る。また、日本に生息する陸棲哺乳類（草食獣を含む）でも最大の種である。,北海道,1,4月-11月,brown_bear
ヤマネ,本州や四国，九州、隠岐島後の森の中に暮らしています。木の上で生活し，夜に行動します。日本にはナウマンゾウがいた頃から暮らしていて，生きた化石と言われています。体は小さいですが，とても広い行動域を持ちます。約１ヶ月の妊娠期間をへて，3〜7頭の子どもを産みます,本州・四国・九州,234,1年中,dormouse
モグラ,眼は小型で体毛に埋まり、チチュウカイモグラなどのように皮膚に埋もれる種もいる。明度はわかるものの、視覚はほとんど発達しない。ヒミズ類の一部を除き耳介はない。鼻面は長く管状で、下唇よりも突出する。鼻面には触毛を除いて体毛はなく、ホシバナモグラでは吻端に肉質の突起がある,本州・四国・九州,234,1年中,mole
サギ,あまり動かず､水辺でじっとして魚などが近づくと首を伸ばして捕えます。ダイサギ・コサギはいわゆる白鷺の仲間で、大きさによって種が分かれています。,北海道・本州・四国・九州・沖縄,12345,1年中,great_egret
ヤドカリ,エビやカニと同じ「十脚甲殻類」の仲間。別の生きものである巻貝の殻を背負っている。はさみ脚と歩くための脚の合計が10本。,全国どこでも,12345,1年中,hermit_crab
ヒアリ,毒を持つアリ。人間が刺されても死ぬことはまれだが、もし刺された場合は焦らずに病院へいこう。もともとはアルゼンチンやパラグアイなどに生息していたが、近年外国の貨物コンテナから日本に侵入したと考えられている。,本州，四国，九州・沖縄,2345,1年中,ant
キンギョ,金魚はフナから生まれたヒブナを改良してできましたが、金魚の中でもワキンは原種にちかい品種です。江戸時代になって新しく輸入された金魚と区別する為に和金と呼ぶようになったと言われます。,北海道・本州・四国・九州・沖縄,12345,1年中,goldfish